{
  "schema_version": "1.0.0",
  "methodology_version": "2026.06.04",
  "project": {
    "name": "KIRBY_FAN GAME CLOUDE [VER.001] [SGDK 211] [GEN] [GAME] [ACTION_PLATFORMER]",
    "lifecycle": "existing",
    "project_root_policy": "all_project_material_inside_project"
  },
  "active_workflow": "production-loop",
  "required_skills": [
    "governance/truth-hierarchy-guard",
    "governance/doc-sync-audit",
    "operation/sgdk-build-wrapper-operator",
    "art/visual-excellence-standards",
    "code/sgdk-runtime-coder"
  ],
  "required_validations": [
    "preflight_host",
    "validate_resources",
    "scene_closeout_gate",
    "freshness_audit",
    "project_hygiene",
    "project_context"
  ],
  "claims": {
    "critical_motion": {
      "applicability": "required",
      "rationale": "O slice promete locomocao, pulo, inalacao e ataques legiveis; a producao de strip fica condicionada ao gate humano e a prova de movimento."
    },
    "road_physics": {
      "applicability": "not_applicable",
      "rationale": "Vegetable Valley e plataforma lateral; nao ha estrada, chase veicular ou fisica de pista no escopo vigente."
    },
    "modular_boss": {
      "applicability": "required",
      "rationale": "Whispy Woods ja usa segmentos articulados e tem cena propria; o claim permanece bloqueado para closeout ate contrato e evidencia do rig."
    }
  }
}
